[
  {"id": "M001-E0001", "match_id": "M001", "t": 0.0, "period": 1, "minute": 0, "team": "NBU",
   "player_id": "NBU-08", "related_player_id": "NBU-06", "type": "pass",
   "x": 50.0, "y": 50.0, "end_x": 42.5, "end_y": 38.0, "outcome": "success",
   "under_pressure": false, "body_part": "foot", "xg": null},
  {"id": "M001-E0412", "match_id": "M001", "t": 1985.4, "period": 1, "minute": 33, "team": "KES",
   "player_id": "KES-09", "type": "shot", "x": 88.0, "y": 46.0, "end_x": 100.0, "end_y": 48.0,
   "outcome": "goal", "under_pressure": true, "body_part": "head", "xg": 0.21},
  {"id": "M001-E0413", "match_id": "M001", "t": 1985.4, "period": 1, "minute": 33, "team": "KES",
   "player_id": "KES-09", "type": "goal", "x": 88.0, "y": 46.0, "under_pressure": true},
  {"id": "M001-E1102", "match_id": "M001", "t": 3720.0, "period": 2, "minute": 62, "team": "NBU",
   "player_id": "NBU-11", "related_player_id": "NBU-19", "type": "sub", "x": 50.0, "y": 0.0,
   "under_pressure": false}
]
